scene_id;start;end;avscript;transcripts
1;0.0;9.666666417093523;餐厅内，一人差点将对面的人绊倒，抱歉说“哎，不好意思啊，我天呐差点把你绊倒，今天怎么回事啊”。;哎,不好意思啊,我天呐差点把你绊倒,今天怎么回事啊,
2;9.666666417093523;62.39999838896233;大楼内部，男子讲解操作电梯按钮位置上行下行。;对,大家可以看到这个地方的话,他这个会有两个按钮,一个上一个下,哎我应该没按着这个吧,也不太知道,这个是下行,这个是上行,关,一楼,好刚才没按上,
3;62.39999838896233;80.73333124896729;楼道内，一人用导盲杖行走，说“这应该是一楼吧，好谢谢啊，那个电梯，时间长了，有点老了”;这应该是一楼吧,好谢谢啊,那个电梯,时间长了,有点老了,
4;80.73333124896729;107.73333055188368;特殊教育学院内，一人走出室内并探路扶杆，说“OK不好意思，再地铁站或者火车站，一般都会有语音播报”。;OK不好意思,在地铁站或者火车站那种无障碍电梯,一般他都会有语音播报,盲盒,请,
5;107.73333055188368;154.3666626812417;街道上，一人边走边说去天桥对面吃喜欢的东西并跟随栅栏以保持方向。;今天我们再到天桥对面,我先挂了,OK,到天桥对面去吃一家我很喜欢吃的,东东,先卖个关子,好久没吃了,我好像走偏了,所以说还是得经常打着一下,左边的这个,右边的这个,哦,右边的这个栅栏,要不然不自觉的就会走偏,
6;154.3666626812417;168.5666623146274;"户外，男子在停车线旁走动，说""顺着这个边走，啊我又走偏了""。";时不时打一下,然后确定位置,所以他还挺好,跟盲道一样,顺着这个边,然后我又走偏了,
7;168.5666623146274;198.26666154783544;户外，一人行至台阶，说“应该快到头了吧”，然后上台阶，说“从这儿就可以上去了”。;应该快到头了吧,快到了,OK,到了,现在就可以上去了,OK,好的,
8;198.26666154783544;232.99999398442665;"天桥上，一行人边走边说""打到这个墙边，这样就不会走歪，一会可以给大家看看""，提到夕阳可能会好看。";打到这个墙边,这样就不会走歪,太阳落下去了吗,一会可以给大家看看,现在是夕阳吗,我也不太知道,如果是夕阳的话,应该会挺好看的,但如果没有的话,嗯,那我就没办法喽,
9;232.99999398442665;271.29999299560063;户外天桥，行人走动。有人说：“我往左走，要不然一会下楼梯容易踩空。”;我往左走,要不然，不好意思啊,要不然一会下楼梯,要不然一会下楼梯容易踩空,不知道楼梯啥时候来,OK,这样的话就不用怕了,因为前面是无障碍坡道,
10;271.29999299560063;295.63332570069815;天桥上，一人戴着引导杖行走，说“好像快到了吧，OK”。;两八八折,快到了吧,OK,
11;295.63332570069815;316.0999918389582;商场内，一人持导盲杖行走，说“我真是越来越厉害了，走的越来越熟了”。;我真是越来越厉害了,走的越来越熟了,
12;316.0999918389582;335.1333246808906;食堂，戴手表和持辅助棍的男子正走动，说“他们选狗，因为我走的比较慢，还剩个凉皮”。;他们选狗,因为我走的比较慢,还剩个凉皮,剩混蛋不吃这个这个呀嗯,
13;335.1333246808906;342.06665783521976;餐厅内，一男子拿着饭盘在自助餐台选菜，说“那还有凉皮呢，下回来可以吃，这回就先不了。”;那还有凉皮呢,下回来可以吃,这回就先不了,
14;342.06665783521976;426.466655656188;食堂，一个人在自助餐区用餐盘取菜，旁边学生排队打餐，说“我碰到他了，他跟我说不好意思”。;191腊肠炒饭好了啊,我碰着他了,他跟我说不好意思,因为我不知道他从外面过去,哦,哎,我就感觉快到了,我天呐,恨死我了,感觉到了,怎么没有打,真的,哎,气死我了,嗯,这疼死我了,就差了一点点,
15;426.466655656188;448.7333217479759;食堂内，一男子询问是否有巴沙鱼粉，店员回应可以在此食用。;您好这是鱼粉吗,这是鱼粉吗,吃鱼粉啊,哎,呃原味的巴沙鱼,巴沙鱼,对,在这吃啊,对在这吃,
16;448.7333217479759;455.29998824510494;食堂，一名戴帽子的工作人员与顾客交谈：“忌不忌口，不忌口啊，那行，那您一会能帮我拿一下吗，好谢谢啊”;忌不忌口,不忌口啊,那行,那您一会能帮我拿一下吗,好谢谢啊,
17;455.29998824510494;475.2333210638012;"食堂，几名男子在享用巴沙鱼，其中一人说：""筷子呢啊，好嘞好嘞。""";撞着左边的额头,原味的巴沙鱼,筷子呢啊,筷子我要用筷子,好嘞好嘞,
18;475.2333210638012;509.3333201834105;食堂内，一人加生菜葱花后，搅拌均匀，说“搅拌均匀，这个非常好吃，特别喜欢吃，有点烫”。;好嘞好嘞,慢点啊好,谢谢加的生菜葱花好,搅拌均匀,这个非常好吃,特别喜欢吃,有点烫,
19;509.3333201834105;534.3999862029082;食堂内，一人吃完饭后提到不好稳，想请阿姨或大爷帮忙收拾。;好吃完啦,这个我就不扔了因为我,不太能找到,端着它的话就更走不稳了,一会,让阿姨或者姑大爷帮我收一下吧,
20;534.3999862029082;574.7666518273918;学校食堂，学生拿餐出食堂，说“我这回我走慢点”，工作人员回应，“好，谢谢您啊”。;那我们学校的话,嗯对于我们师范的学生不用收那个,不对我要出去,刚才我碰了一下,我这回我走慢点,哈哈哈,没事你现在你不用管我现在可以了,好谢谢你啊,我们学校就我们市长的同学来说,还是比较好的,吃完可以不用送,因为不太方便嘛,
21;574.7666518273918;587.5333181644498;学校食堂，一人走入说“哎呀我恨这个门，我已经很久没有碰了”，随后进入食堂。;哎呀我恨这个门,我已经很久没有碰了,
22;587.5333181644498;620.0333173253676;食堂内，一男子边走边说：“现在是全凭感觉，无依无靠的”。他向前方走去，多次与他人对话表达感谢。;现在是全凭感觉,无依无靠的,哦不好意思啊不好意思打扰你了,好好好好谢谢啊,哎,
23;620.0333173253676;657.4333163597778;"商场内，男子用拐杖导航，走出门上天桥讲""今天感知系统失灵了""。";哎不好意思啊,我天呐差点把你绊倒,今天怎么回事啊,差点晚上班吧,我本来是想看那个墙壁的,今天感知系统失灵了,哈哈哈,哎呦真的是,倒着了现在应该安全,应该没问题慢点,
24;657.4333163597778;685.8666489590219;"天桥上，男子拍摄并述说""吃了个饭现在这没那么疼，但是还是有点疼，我的天呐，可能还是以前眼睛好的时候手快，还是得慢点啊""。";啊,吃了个饭,现在这没没那么疼,但是还是有点疼,我的天呐,缺一天长一痣,慢点还是,可能还是以前眼睛好的时候手快,手习惯了改不了就出门,慢点啊,怎么看就容易发生危险,
25;685.8666489590219;695.4666487111699;"天桥上，几个人走向镜头, ""上一次应该还是取快递那次吧。""";真的挺久时间没有碰到,上一次应该还是取快递那次,撞那个铁铁铁架子,
26;695.4666487111699;740.2333142220547;学校附近，人群纷纷下课离开，有人说“靠右行驶，别挡着人家走路”。;靠右行驶,别挡着人家走路,这边好像下课了,人多了起来,像现在的话就完全凭感觉走,大概多远,全凭感觉,哎好找的就是你,
27;740.2333142220547;778.5666465657015;傍晚，校园内，小路旁，男子独自走路，说“先走一段再往右走，因为好像这边是一个女生宿舍”。;先走一段再往右走,因为好像这边的话他是一个女生宿舍,门口没有花坛,没法确定那个位置,哎,这些都是走的时间长了总结出来的,之前,我记得两三年之前,我就不敢一个人过来了,现在强很多了,练出来,哎呀,
28;778.5666465657015;808.0;室外和室内，一人行走并说“那就拜拜啦,okay,okay”、“好啦 我回来了”。;那就拜拜啦,okay,okay,
